[I 2026-06-25 18:41:29,094] Trial 13 finished with value: 0.0 and parameters: {'moe_runner_backend': 'triton', 'disable_cuda_graph': False, 'max_running_requests': 8, 'chunked_prefill_size': 8192, 'schedule_policy': 'lpm'}. Best is trial 4 with value: 14.23103279139821.
2026-06-25 18:41:29,195 [INFO] trial 14: flags={'moe-runner-backend': 'triton', 'disable-cuda-graph': False, 'max-running-requests': 64, 'chunked-prefill-size': -1, 'schedule-policy': 'fcfs'}
2026-06-25 18:41:29,196 [INFO] trial 14: launching harness
2026-06-25 18:42:56,919 [INFO] trial 14: harness returned in 87.7s, exit=0
2026-06-25 18:42:56,966 [INFO] trial 14: R_long_prefill req/s = 13.760
[I 2026-06-25 18:42:56,986] Trial 14 finished with value: 13.759728310333012 and parameters: {'moe_runner_backend': 'triton', 'disable_cuda_graph': False, 'max_running_requests': 64, 'chunked_prefill_size': -1, 'schedule_policy': 'fcfs'}. Best is trial 4 with value: 14.23103279139821.
2026-06-25 18:42:56,987 [INFO] BEST trial #4: value=14.231, params={'moe_runner_backend': 'flashinfer_cutlass', 'disable_cuda_graph': False, 'max_running_requests': 8, 'chunked_prefill_size': -1, 'schedule_policy': 'fcfs'}
2026-06-25 18:42:56,991 [INFO] wrote results/2026-06-25_autotuning/per_regime/R_long_prefill_gpu4/best.json
[Thu Jun 25 18:42:57 UTC 2026] Done with R_long_prefill
[Thu Jun 25 18:42:57 UTC 2026] All studies on GPU 4 complete.
