[I 2026-06-25 18:45:28,753] Trial 13 finished with value: 0.0 and parameters: {'moe_runner_backend': 'flashinfer_cutlass', 'disable_cuda_graph': True, 'max_running_requests': 64, 'chunked_prefill_size': -1, 'schedule_policy': 'fcfs'}. Best is trial 9 with value: 13.978128146530954.
2026-06-25 18:45:28,847 [INFO] trial 14: flags={'moe-runner-backend': 'flashinfer_cutlass', 'disable-cuda-graph': False, 'max-running-requests': 32, 'chunked-prefill-size': 2048, 'schedule-policy': 'fcfs'}
2026-06-25 18:45:28,848 [INFO] trial 14: launching harness
2026-06-25 18:47:00,586 [INFO] trial 14: harness returned in 91.7s, exit=0
2026-06-25 18:47:00,630 [INFO] trial 14: R_concurrent_decode req/s = 13.922
[I 2026-06-25 18:47:00,650] Trial 14 finished with value: 13.921747118014723 and parameters: {'moe_runner_backend': 'flashinfer_cutlass', 'disable_cuda_graph': False, 'max_running_requests': 32, 'chunked_prefill_size': 2048, 'schedule_policy': 'fcfs'}. Best is trial 9 with value: 13.978128146530954.
2026-06-25 18:47:00,651 [INFO] BEST trial #9: value=13.978, params={'moe_runner_backend': 'flashinfer_cutlass', 'disable_cuda_graph': False, 'max_running_requests': 32, 'chunked_prefill_size': -1, 'schedule_policy': 'fcfs'}
2026-06-25 18:47:00,655 [INFO] wrote results/2026-06-25_autotuning/per_regime/R_concurrent_decode_gpu5/best.json
[Thu Jun 25 18:47:00 UTC 2026] Done with R_concurrent_decode
[Thu Jun 25 18:47:00 UTC 2026] All studies on GPU 5 complete.
